{
  "file_name": "cytosine_ribose_phosphate_conf44_pcm_water.log",
  "sha256": "c5eebeb27b999d667f7d4c0ed520ce13f1d61a6365f37a30f9a92c690c9d6a8d",
  "status": "valid",
  "failures": "",
  "warnings": "",
  "functional": "B3LYP",
  "basis_set": "6-311++G(2DF,2P)",
  "solvent_model": "PCM",
  "solvent": "WATER",
  "route_fingerprint": "B3LYP|6-311++G(2DF,2P)|PCM|WATER",
  "formula": "C9H14N3O8P",
  "formula_key": "C:9|H:14|N:3|O:8|P:1",
  "connectivity_fingerprint": "92d43d4d856974eab23c2fd34581ba33853ceaa97dd34f8131453121e8f08f1f",
  "charge": 0,
  "multiplicity": 1,
  "atom_count": 35,
  "normal_termination_count": 2,
  "optimization_completed": true,
  "frequency_count": 99,
  "expected_frequency_count": 99,
  "imaginary_frequency_count": 0,
  "minimum_frequency_cm1": 25.5402,
  "temperature_k": 298.0,
  "pressure_atm": 1.0,
  "electronic_energy_hartree": -1459.38980756,
  "thermal_gibbs_correction_hartree": 0.213854,
  "computed_gibbs_hartree": -1459.17595356,
  "printed_gibbs_hartree": -1459.175954,
  "gibbs_residual_hartree": 4.4000012167089153e-07,
  "geometry_source": "frequency_job",
  "geometry_source_line": 13513,
  "geometry_precision_angstrom": 1e-06,
  "atom_indices": "1-based source orientation order",
  "linear_geometry": false,
  "thermo_segment_first_line": 13059,
  "thermo_segment_last_line": 17433,
  "gaussian_version": "Gaussian 16, Revision B.01,",
  "calculation_id": "calc_c5eebeb27b999d66",
  "source_log_sha256": "c5eebeb27b999d667f7d4c0ed520ce13f1d61a6365f37a30f9a92c690c9d6a8d",
  "source_log_name": "cytosine_ribose_phosphate_conf44_pcm_water.log",
  "source_lines": {
    "formula": 13507,
    "electronic_energy_hartree": 13605,
    "zpe_correction_hartree": 15736,
    "thermal_energy_correction_hartree": 15737,
    "thermal_enthalpy_correction_hartree": 15738,
    "thermal_gibbs_correction_hartree": 15739,
    "electronic_plus_zpe_hartree": 15740,
    "H_hartree": 15742,
    "printed_gibbs_hartree": 15743,
    "entropy_cal_mol_k": 15747
  },
  "frequency_job_normally_terminated": true,
  "zpe_correction_hartree": 0.263264,
  "thermal_energy_correction_hartree": 0.283197,
  "thermal_enthalpy_correction_hartree": 0.28414,
  "electronic_plus_zpe_hartree": -1459.126543,
  "H_hartree": -1459.105667,
  "entropy_cal_mol_k": 148.005,
  "geometry_fragments": [
    [
      1,
      2,
      3,
      4,
      5,
      6,
      7,
      8,
      9,
      10,
      11,
      12,
      13,
      14,
      15,
      16,
      17,
      18,
      19,
      20,
      21,
      22,
      23,
      24,
      25,
      26,
      27,
      28,
      29,
      30,
      31,
      32,
      33,
      34,
      35
    ]
  ],
  "distance_inferred_edges": [
    [
      1,
      5
    ],
    [
      1,
      7
    ],
    [
      1,
      8
    ],
    [
      1,
      9
    ],
    [
      2,
      15
    ],
    [
      2,
      16
    ],
    [
      3,
      13
    ],
    [
      3,
      28
    ],
    [
      4,
      14
    ],
    [
      4,
      29
    ],
    [
      5,
      17
    ],
    [
      6,
      19
    ],
    [
      7,
      34
    ],
    [
      8,
      35
    ],
    [
      10,
      16
    ],
    [
      10,
      18
    ],
    [
      10,
      19
    ],
    [
      11,
      19
    ],
    [
      11,
      21
    ],
    [
      12,
      21
    ],
    [
      12,
      32
    ],
    [
      12,
      33
    ],
    [
      13,
      14
    ],
    [
      13,
      15
    ],
    [
      13,
      22
    ],
    [
      14,
      16
    ],
    [
      14,
      23
    ],
    [
      15,
      17
    ],
    [
      15,
      24
    ],
    [
      16,
      25
    ],
    [
      17,
      26
    ],
    [
      17,
      27
    ],
    [
      18,
      20
    ],
    [
      18,
      30
    ],
    [
      20,
      21
    ],
    [
      20,
      31
    ]
  ],
  "bond_definition_note": "Distance-inferred adjacency, not an assignment of chemical bond orders or absolute stereochemistry.",
  "units": {
    "coordinates": "angstrom",
    "frequencies": "cm^-1",
    "energies": "hartree per particle",
    "temperature": "K",
    "pressure": "atm",
    "entropy": "cal mol^-1 K^-1"
  },
  "schema_version": "1.0",
  "files": {
    "frequencies.csv": "bc7d32abe098e9f04d8b4c8e0c8d7b9b3273875305318a344d4943f62ab4b207",
    "optimized.xyz": "d686dc7e6cdaea03b7d9e2e9e95f82ba8ab759e6bd6f3875445dad2b2f730108",
    "starting.xyz": "c9d5d342a0aa9d308528837412e23a4203c0c2ecafe469f2387419359f035833"
  },
  "geometry_file": "optimized.xyz"
}
