{
  "file_name": "guanine_pcm_water.log",
  "sha256": "54a013183407b3a3935593afaebee00bc13cf17419798fe28bc2af4835170ef7",
  "status": "valid",
  "failures": "",
  "warnings": "",
  "functional": "WB97XD",
  "basis_set": "6-311++G(2DF,2P)",
  "solvent_model": "PCM",
  "solvent": "WATER",
  "route_fingerprint": "WB97XD|6-311++G(2DF,2P)|PCM|WATER",
  "formula": "C5H5N5O",
  "formula_key": "C:5|H:5|N:5|O:1",
  "connectivity_fingerprint": "adfd06c6215d53281eb23e38ce7957b310d2d3da212ac6aa137511c8c1c57104",
  "charge": 0,
  "multiplicity": 1,
  "atom_count": 16,
  "normal_termination_count": 2,
  "optimization_completed": true,
  "frequency_count": 42,
  "expected_frequency_count": 42,
  "imaginary_frequency_count": 0,
  "minimum_frequency_cm1": 145.4865,
  "temperature_k": 298.0,
  "pressure_atm": 1.0,
  "electronic_energy_hartree": -542.587948644,
  "thermal_gibbs_correction_hartree": 0.08545,
  "computed_gibbs_hartree": -542.502498644,
  "printed_gibbs_hartree": -542.502499,
  "gibbs_residual_hartree": 3.5599998682300793e-07,
  "geometry_source": "frequency_job",
  "geometry_source_line": 3788,
  "geometry_precision_angstrom": 1e-06,
  "atom_indices": "1-based source orientation order",
  "linear_geometry": false,
  "thermo_segment_first_line": 3589,
  "thermo_segment_last_line": 5209,
  "gaussian_version": "Gaussian 16, Revision B.01,",
  "calculation_id": "calc_54a013183407b3a3",
  "source_log_sha256": "54a013183407b3a3935593afaebee00bc13cf17419798fe28bc2af4835170ef7",
  "source_log_name": "guanine_pcm_water.log",
  "source_lines": {
    "formula": 3782,
    "electronic_energy_hartree": 3882,
    "zpe_correction_hartree": 4611,
    "thermal_energy_correction_hartree": 4612,
    "thermal_enthalpy_correction_hartree": 4613,
    "thermal_gibbs_correction_hartree": 4614,
    "electronic_plus_zpe_hartree": 4615,
    "H_hartree": 4617,
    "printed_gibbs_hartree": 4618,
    "entropy_cal_mol_k": 4622
  },
  "frequency_job_normally_terminated": true,
  "zpe_correction_hartree": 0.118352,
  "thermal_energy_correction_hartree": 0.126503,
  "thermal_enthalpy_correction_hartree": 0.127446,
  "electronic_plus_zpe_hartree": -542.469596,
  "H_hartree": -542.460502,
  "entropy_cal_mol_k": 88.434,
  "geometry_fragments": [
    [
      1,
      2,
      3,
      4,
      5,
      6,
      7,
      8,
      9,
      10,
      11,
      12,
      13,
      14,
      15,
      16
    ]
  ],
  "distance_inferred_edges": [
    [
      1,
      9
    ],
    [
      2,
      7
    ],
    [
      2,
      11
    ],
    [
      2,
      12
    ],
    [
      3,
      9
    ],
    [
      3,
      10
    ],
    [
      3,
      13
    ],
    [
      4,
      8
    ],
    [
      4,
      10
    ],
    [
      5,
      8
    ],
    [
      5,
      11
    ],
    [
      6,
      10
    ],
    [
      6,
      15
    ],
    [
      6,
      16
    ],
    [
      7,
      8
    ],
    [
      7,
      9
    ],
    [
      11,
      14
    ]
  ],
  "bond_definition_note": "Distance-inferred adjacency, not an assignment of chemical bond orders or absolute stereochemistry.",
  "units": {
    "coordinates": "angstrom",
    "frequencies": "cm^-1",
    "energies": "hartree per particle",
    "temperature": "K",
    "pressure": "atm",
    "entropy": "cal mol^-1 K^-1"
  },
  "schema_version": "1.0",
  "files": {
    "frequencies.csv": "547611a7faf0b92772fca019f5244fd101b5a8cc1db1409af6171fd28ea86059",
    "optimized.xyz": "b44fab464b190604b69210fcf49d4162c6270efa023848feff48c5e429fdf8d3",
    "starting.xyz": "a12000e62fd2a54a8f3f42477115a9b535223fb244fc7a5232870c37b3933b05"
  },
  "geometry_file": "optimized.xyz"
}
