{
  "file_name": "ribo_phosphate_conf122_pcm_water.log",
  "sha256": "112bc66d606d6fdc8828e4400350a274079064fd83e34d451874d9bfe5fbbd1b",
  "status": "valid",
  "failures": "",
  "warnings": "",
  "functional": "B3LYP",
  "basis_set": "6-311++G(2DF,2P)",
  "solvent_model": "PCM",
  "solvent": "WATER",
  "route_fingerprint": "B3LYP|6-311++G(2DF,2P)|PCM|WATER",
  "formula": "C5H11O8P",
  "formula_key": "C:5|H:11|O:8|P:1",
  "connectivity_fingerprint": "33574217d6ecee17adbc4645f14135ec7b1cd18c88b28defc26cb17ab7ddac60",
  "charge": 0,
  "multiplicity": 1,
  "atom_count": 25,
  "normal_termination_count": 2,
  "optimization_completed": true,
  "frequency_count": 69,
  "expected_frequency_count": 69,
  "imaginary_frequency_count": 0,
  "minimum_frequency_cm1": 21.5644,
  "temperature_k": 298.0,
  "pressure_atm": 1.0,
  "electronic_energy_hartree": -1140.75485077,
  "thermal_gibbs_correction_hartree": 0.142951,
  "computed_gibbs_hartree": -1140.61189977,
  "printed_gibbs_hartree": -1140.611899,
  "gibbs_residual_hartree": -7.700000423938036e-07,
  "geometry_source": "frequency_job",
  "geometry_source_line": 27999,
  "geometry_precision_angstrom": 1e-06,
  "atom_indices": "1-based source orientation order",
  "linear_geometry": false,
  "thermo_segment_first_line": 27688,
  "thermo_segment_last_line": 30408,
  "gaussian_version": "Gaussian 16, Revision B.01,",
  "calculation_id": "calc_112bc66d606d6fdc",
  "source_log_sha256": "112bc66d606d6fdc8828e4400350a274079064fd83e34d451874d9bfe5fbbd1b",
  "source_log_name": "ribo_phosphate_conf122_pcm_water.log",
  "source_lines": {
    "formula": 27993,
    "electronic_energy_hartree": 28081,
    "zpe_correction_hartree": 29349,
    "thermal_energy_correction_hartree": 29350,
    "thermal_enthalpy_correction_hartree": 29351,
    "thermal_gibbs_correction_hartree": 29352,
    "electronic_plus_zpe_hartree": 29353,
    "H_hartree": 29355,
    "printed_gibbs_hartree": 29356,
    "entropy_cal_mol_k": 29360
  },
  "frequency_job_normally_terminated": true,
  "zpe_correction_hartree": 0.187604,
  "thermal_energy_correction_hartree": 0.203198,
  "thermal_enthalpy_correction_hartree": 0.204142,
  "electronic_plus_zpe_hartree": -1140.567247,
  "H_hartree": -1140.550709,
  "entropy_cal_mol_k": 128.852,
  "geometry_fragments": [
    [
      1,
      2,
      3,
      4,
      5,
      6,
      7,
      8,
      9,
      10,
      11,
      12,
      13,
      14,
      15,
      16,
      17,
      18,
      19,
      20,
      21,
      22,
      23,
      24,
      25
    ]
  ],
  "distance_inferred_edges": [
    [
      1,
      6
    ],
    [
      1,
      7
    ],
    [
      1,
      8
    ],
    [
      1,
      9
    ],
    [
      2,
      11
    ],
    [
      2,
      13
    ],
    [
      3,
      10
    ],
    [
      3,
      21
    ],
    [
      4,
      12
    ],
    [
      4,
      22
    ],
    [
      5,
      13
    ],
    [
      5,
      23
    ],
    [
      6,
      14
    ],
    [
      7,
      24
    ],
    [
      8,
      25
    ],
    [
      10,
      11
    ],
    [
      10,
      12
    ],
    [
      10,
      15
    ],
    [
      11,
      14
    ],
    [
      11,
      16
    ],
    [
      12,
      13
    ],
    [
      12,
      17
    ],
    [
      13,
      18
    ],
    [
      14,
      19
    ],
    [
      14,
      20
    ]
  ],
  "bond_definition_note": "Distance-inferred adjacency, not an assignment of chemical bond orders or absolute stereochemistry.",
  "units": {
    "coordinates": "angstrom",
    "frequencies": "cm^-1",
    "energies": "hartree per particle",
    "temperature": "K",
    "pressure": "atm",
    "entropy": "cal mol^-1 K^-1"
  },
  "schema_version": "1.0",
  "files": {
    "frequencies.csv": "9bb98a03aaaec51f68ab6eee6d08568909de2755a1a833cb061114f7d4ca7203",
    "optimized.xyz": "1e738a0f2da8252036dad92f2ec7fee4043f7c3f448bdc27d2aaeb77502dfc5c",
    "starting.xyz": "2372335cd4606cb8e8bd7cb0ab8ea978c37c9649ce0c1d4ec42b460feb35bcde"
  },
  "geometry_file": "optimized.xyz"
}
