{
  "file_name": "phosphate_pcm_water.log",
  "sha256": "9245a11b85b2f14777d548412abcd60b5b5022da6b00ee61668d3ace2a1e47e2",
  "status": "valid",
  "failures": "",
  "warnings": "",
  "functional": "WB97XD",
  "basis_set": "6-311++G(2DF,2P)",
  "solvent_model": "PCM",
  "solvent": "WATER",
  "route_fingerprint": "WB97XD|6-311++G(2DF,2P)|PCM|WATER",
  "formula": "H3O4P",
  "formula_key": "H:3|O:4|P:1",
  "connectivity_fingerprint": "5c4789f10422fe6fa2dd1a0e8ed5649bfd2718c05ac8c1a1dacb93fd5617d656",
  "charge": 0,
  "multiplicity": 1,
  "atom_count": 8,
  "normal_termination_count": 2,
  "optimization_completed": true,
  "frequency_count": 18,
  "expected_frequency_count": 18,
  "imaginary_frequency_count": 0,
  "minimum_frequency_cm1": 159.8386,
  "temperature_k": 298.0,
  "pressure_atm": 1.0,
  "electronic_energy_hartree": -644.236404634,
  "thermal_gibbs_correction_hartree": 0.019953,
  "computed_gibbs_hartree": -644.216451634,
  "printed_gibbs_hartree": -644.216451,
  "gibbs_residual_hartree": -6.340000027194037e-07,
  "geometry_source": "frequency_job",
  "geometry_source_line": 6032,
  "geometry_precision_angstrom": 1e-06,
  "atom_indices": "1-based source orientation order",
  "linear_geometry": false,
  "thermo_segment_first_line": 5928,
  "thermo_segment_last_line": 6757,
  "gaussian_version": "Gaussian 16, Revision B.01,",
  "calculation_id": "calc_9245a11b85b2f147",
  "source_log_sha256": "9245a11b85b2f14777d548412abcd60b5b5022da6b00ee61668d3ace2a1e47e2",
  "source_log_name": "phosphate_pcm_water.log",
  "source_lines": {
    "formula": 6026,
    "electronic_energy_hartree": 6110,
    "zpe_correction_hartree": 6461,
    "thermal_energy_correction_hartree": 6462,
    "thermal_enthalpy_correction_hartree": 6463,
    "thermal_gibbs_correction_hartree": 6464,
    "electronic_plus_zpe_hartree": 6465,
    "H_hartree": 6467,
    "printed_gibbs_hartree": 6468,
    "entropy_cal_mol_k": 6472
  },
  "frequency_job_normally_terminated": true,
  "zpe_correction_hartree": 0.049127,
  "thermal_energy_correction_hartree": 0.055235,
  "thermal_enthalpy_correction_hartree": 0.056179,
  "electronic_plus_zpe_hartree": -644.187278,
  "H_hartree": -644.180226,
  "entropy_cal_mol_k": 76.281,
  "geometry_fragments": [
    [
      1,
      2,
      3,
      4,
      5,
      6,
      7,
      8
    ]
  ],
  "distance_inferred_edges": [
    [
      1,
      2
    ],
    [
      1,
      3
    ],
    [
      1,
      4
    ],
    [
      1,
      5
    ],
    [
      2,
      6
    ],
    [
      3,
      7
    ],
    [
      4,
      8
    ]
  ],
  "bond_definition_note": "Distance-inferred adjacency, not an assignment of chemical bond orders or absolute stereochemistry.",
  "units": {
    "coordinates": "angstrom",
    "frequencies": "cm^-1",
    "energies": "hartree per particle",
    "temperature": "K",
    "pressure": "atm",
    "entropy": "cal mol^-1 K^-1"
  },
  "schema_version": "1.0",
  "files": {
    "frequencies.csv": "0562353aea8080e9790461d212f995e7a30de4c4a651d1c7b6cb5312e05a5c66",
    "optimized.xyz": "99ac059801dbd6147fb517a19878d7b82274a5a098b757ecddce62b2e4569c4d",
    "starting.xyz": "ff1933b1fb78877aad1230a725bbbf7bce902bbb8c216f26b1d4019ea4dfe7ce"
  },
  "geometry_file": "optimized.xyz"
}
